{
  "format": "glowbe-layout",
  "version": 1,
  "id": "geodesic-2v-60",
  "displayName": "Geodesic 2V (60 panels)",
  "variant": "geodesic-2v-60",
  "geometry": {
    "preset": "geodesic-ico-2v",
    "radiusMm": 50,
    "units": "mm",
    "disabledFaceIds": [
      "face-60",
      "face-61",
      "face-62",
      "face-63",
      "face-64",
      "face-65",
      "face-66",
      "face-67",
      "face-68",
      "face-69",
      "face-70",
      "face-71",
      "face-72",
      "face-73",
      "face-74",
      "face-75",
      "face-76",
      "face-77",
      "face-78",
      "face-79"
    ]
  },
  "face": {
    "ledCount": 21,
    "pattern": "zigzag",
    "paddingMm": 2,
    "chainMirrorLR": true
  },
  "wiring": {
    "chip": "SK6805",
    "colorOrder": "GRB",
    "dataLines": [
      {
        "gpio": 13,
        "faceChain": [
          "face-26",
          "face-30",
          "face-31",
          "face-29",
          "face-5"
        ],
        "faceRotations": {
          "face-26": 0,
          "face-30": 0,
          "face-31": 1,
          "face-29": 2,
          "face-5": 2
        },
        "reversedFaces": []
      },
      {
        "gpio": 14,
        "faceChain": [
          "face-24",
          "face-27",
          "face-25",
          "face-28",
          "face-6",
          "face-7",
          "face-4"
        ],
        "faceRotations": {
          "face-24": 1,
          "face-27": 0,
          "face-25": 2,
          "face-28": 1,
          "face-6": 0,
          "face-7": 2,
          "face-4": 1
        },
        "reversedFaces": []
      },
      {
        "gpio": 16,
        "faceChain": [
          "face-58",
          "face-22",
          "face-23",
          "face-21",
          "face-1"
        ],
        "faceRotations": {
          "face-58": 0,
          "face-22": 0,
          "face-23": 1,
          "face-21": 2,
          "face-1": 2
        },
        "reversedFaces": []
      },
      {
        "gpio": 17,
        "faceChain": [
          "face-56",
          "face-59",
          "face-57",
          "face-20",
          "face-2",
          "face-3",
          "face-0"
        ],
        "faceRotations": {
          "face-56": 1,
          "face-59": 0,
          "face-57": 2,
          "face-20": 1,
          "face-2": 0,
          "face-3": 2,
          "face-0": 1
        },
        "reversedFaces": []
      },
      {
        "gpio": 18,
        "faceChain": [
          "face-50",
          "face-54",
          "face-55",
          "face-53",
          "face-17"
        ],
        "faceRotations": {
          "face-50": 0,
          "face-54": 0,
          "face-55": 1,
          "face-53": 2,
          "face-17": 2
        },
        "reversedFaces": []
      },
      {
        "gpio": 25,
        "faceChain": [
          "face-48",
          "face-51",
          "face-49",
          "face-52",
          "face-18",
          "face-19",
          "face-16"
        ],
        "faceRotations": {
          "face-48": 1,
          "face-51": 0,
          "face-49": 2,
          "face-52": 1,
          "face-18": 0,
          "face-19": 2,
          "face-16": 1
        },
        "reversedFaces": []
      },
      {
        "gpio": 23,
        "faceChain": [
          "face-42",
          "face-46",
          "face-47",
          "face-45",
          "face-13"
        ],
        "faceRotations": {
          "face-42": 0,
          "face-46": 0,
          "face-47": 1,
          "face-45": 2,
          "face-13": 2
        },
        "reversedFaces": []
      },
      {
        "gpio": 22,
        "faceChain": [
          "face-40",
          "face-43",
          "face-41",
          "face-44",
          "face-14",
          "face-15",
          "face-12"
        ],
        "faceRotations": {
          "face-40": 1,
          "face-43": 0,
          "face-41": 2,
          "face-44": 1,
          "face-14": 0,
          "face-15": 2,
          "face-12": 1
        },
        "reversedFaces": []
      },
      {
        "gpio": 21,
        "faceChain": [
          "face-34",
          "face-38",
          "face-39",
          "face-37",
          "face-9"
        ],
        "faceRotations": {
          "face-34": 0,
          "face-38": 0,
          "face-39": 1,
          "face-37": 2,
          "face-9": 2
        },
        "reversedFaces": []
      },
      {
        "gpio": 19,
        "faceChain": [
          "face-32",
          "face-35",
          "face-33",
          "face-36",
          "face-10",
          "face-11",
          "face-8"
        ],
        "faceRotations": {
          "face-32": 1,
          "face-35": 0,
          "face-33": 2,
          "face-36": 1,
          "face-10": 0,
          "face-11": 2,
          "face-8": 1
        },
        "reversedFaces": []
      }
    ]
  },
  "meta": {
    "migratedAt": "2026-07-02T11:43:29.763Z",
    "migratedFrom": "glowbe-studio-layout/2",
    "sourceMetaId": "glowbe-prod-geo60"
  }
}
